{
  "version": "realtime-agent.v1",
  "event_id": "evt_command_progress",
  "event_name": "command.progress",
  "timestamp_ms": 1760000000400,
  "user_id": "user-browser-glass-001",
  "producer_id": "dev-browser-glass-001",
  "session_id": "dev-browser-glass-001",
  "payload": {
    "command_id": "cmd_001",
    "command": "haptic.vibrate",
    "progress": 0.5
  }
}
